{
  "allowed_conclusions": [
    "The displayed d_a is a finite-risk positive-affine-equivariant strict improvement over the stable baseline at the balanced (2,2) design.",
    "At q=1/362 the original correction ray is already past its local optimum, and d_(2a) is worse than d_a.",
    "The displayed disjoint two-bump correction strictly improves d_a at every physical parameter.",
    "The anchored finite-packet Bayes excess for d_a has the displayed positive seed-specific floor."
  ],
  "claim_level": "paper proof with exact rational interval certificates; not Lean-kernel evidence",
  "configuration": {
    "design": {
      "m": 2,
      "n": 2
    },
    "part_a": {
      "amplitude_a": {
        "denominator": "250",
        "numerator": "1"
      },
      "coefficients": [
        {
          "denominator": "500000",
          "numerator": "-46233"
        },
        {
          "denominator": "500000",
          "numerator": "294569"
        },
        {
          "denominator": "1000000",
          "numerator": "131993"
        },
        {
          "denominator": "1000000",
          "numerator": "70711"
        }
      ],
      "eta": {
        "denominator": "100000",
        "numerator": "1"
      },
      "frequency_centers": [
        {
          "denominator": "1",
          "numerator": "2"
        },
        {
          "denominator": "50",
          "numerator": "1"
        },
        {
          "denominator": "50",
          "numerator": "1"
        },
        {
          "denominator": "50",
          "numerator": "1"
        }
      ],
      "left_centers": [
        {
          "denominator": "20",
          "numerator": "1"
        },
        {
          "denominator": "20",
          "numerator": "3"
        },
        {
          "denominator": "50",
          "numerator": "1"
        },
        {
          "denominator": "10",
          "numerator": "1"
        }
      ]
    },
    "part_b": {
      "gap_slack": {
        "denominator": "1000",
        "numerator": "1"
      },
      "left_bumps": [
        {
          "F": {
            "denominator": "1000",
            "numerator": "1"
          },
          "coefficient": 3,
          "e": {
            "denominator": "500",
            "numerator": "1"
          }
        },
        {
          "F": {
            "denominator": "1",
            "numerator": "20"
          },
          "coefficient": -4,
          "e": {
            "denominator": "120",
            "numerator": "1"
          }
        }
      ],
      "rho": {
        "denominator": "1000000000000",
        "numerator": "1"
      },
      "step_t": {
        "denominator": "10000",
        "numerator": "1"
      }
    }
  },
  "disallowed_conclusions": [
    "No terminality, admissibility, or master-flatness claim is made for the two-bump descendant.",
    "No four-term residual-defect floor is established.",
    "No result is claimed outside the ordinary balanced (2,2) design.",
    "No conclusions about other estimators or designs follow from these finite certificates alone.",
    "The finite interval covers are certificates through outward enclosures, not pointwise floating grids."
  ],
  "environment": {
    "arithmetic": "fractions.Fraction plus math.isqrt",
    "python": "3.11.15"
  },
  "part_a_certificate": {
    "derivative_center_at_q_1_over_362": {
      "lower": {
        "denominator": "3853668991357309241337187310102599888386227542637201289824970031195137997519661872099310764896779990724119979786823810068033588526105823041214350379864296633421272538766426245540810535558718393316243232431297866007467031250000000000000",
        "numerator": "720756357158182199715193785204522783216353629112876932821765159489795046183383976709584587539082656304531811873370095699844171591450998911849385679158389757388837085755349379413523007625232724680471200742880484788441061585361868510299"
      },
      "upper": {
        "denominator": "466975104943021542677070401083572905339056365539632043160864955731044609013575765237560551145843628783478677663386783480115800768597868665562290202741252465284029098538212824664420279575844106561191257648744215613473523167773437500000000000",
        "numerator": "87338916828906882898410481638325711028543112088389423717602071898718285541590746133719769267976953401063983622444167340113854603072503971478568868666999951086458760629813490456703004855149479547324360286576819497452281851649988831088698329"
      }
    },
    "derivative_exact_lower": {
      "denominator": "553268901665778271109105477949877789754657229137965899858802265140341425568453812226566962375959584103200714608995069681924755629029734514517378266876166167576622197395178260601842232272511555783445949184361058219150589055750778742265010538642057745312500000000000000000000",
      "numerator": "103081811354388094126225717303993394693557092633694120853431650365987847787035669382686510959586690003137585851594970327069731587201384194500772584842224937096326875004445711561591596793691292907107516664810117904097809382774117452708061184107903108802342310178976131241211"
    },
    "derivative_rows": [
      [
        1,
        "low",
        11615,
        56517694,
        2616585,
        43182
      ],
      [
        1,
        "high",
        8,
        3013,
        9,
        5
      ],
      [
        2,
        "low",
        46,
        25667,
        97044,
        441
      ],
      [
        2,
        "high",
        3,
        335,
        5823,
        52
      ],
      [
        3,
        "low",
        17889,
        539960553,
        86037071,
        672982
      ],
      [
        3,
        "high",
        6,
        13142,
        11646,
        55
      ],
      [
        4,
        "low",
        150,
        185176,
        336640,
        257
      ],
      [
        4,
        "high",
        3,
        513,
        5823,
        7
      ]
    ],
    "derivative_tent_error_upper": {
      "denominator": "48611944493535862310609487562112992879687500000000000000000000",
      "numerator": "34858674343807452791312387927275795845497376766374111056011"
    },
    "global_center_cell": 340,
    "global_center_upper": {
      "denominator": "67894273476154765333074068050864959836162590017707142802157783306314110606494705451073302854210174033826814871654176417813095039608310341355076168775682796869312157509758410516767181868825394850076800531680572566651541334436360411183587626055061378844734335964197",
      "numerator": "-15990090941636261330686748858886892057804403777732975571757796649627101699644457963534491214183860757112626273749290381934242782351976199944479473414746028825286221654397604403733246513185788324923363096358639165502950326706866457134045964479481260148764081757655"
    },
    "macro_exact_upper_bounds": [
      {
        "denominator": "1836805018798635908812463055185448520283503843462095173309152874870634616962260421443746797303851976753347929771830385971330342718844350332498837624416902876508944622286498432182088509869515557661123074853564702721602027790074344857608485160765961049027517906655752211498167445268320787863486125",
        "numerator": "-1491220147751246388766152415492369417421205320580708979134469226660817543467512464014375496688850325304741588235281037755500751903210188028237926409717321437576971088845020370746276311290616194366310128496144283952441238273065398888672634046019378587664811991812611602518513730338655917806144604"
      },
      {
        "denominator": "32370388442023372638828270960756746091078791781013514042044512141060309414423558286285641737962557954625852161476241164228145265143078154363790047142687290241785678769006520899397580339898718347472888280995352903287069705451978375641443116082562665966693576221918773194807767206828785606682000",
        "numerator": "-12927324908421980374361225583954078834820089111589510825063396363326950291306842449122689698628445630954864285975855242806667549351407064265334107192320186839120322964226080010973369405640904895506732140123005829938585509831284182379024403517144140611814507006460220069661316259666066349447323"
      },
      {
        "denominator": "108650076451820268290303006198316085928599582298615655433364641130562869935890224820050132017227602552144002564889122751896423117065119923785248505103955725573125164136149300486988237228800912903116395947122784853478451102062269485528190922160478825610074514798640008739273014787427498375",
        "numerator": "-26838515748901103378788952057997333248326188758920839428661276895747226446977681067136697939746274033695383040002077383990414885482957116282841914478675218638183018795618257966535122876060999132425265756780030629053400773248696818482866737478676045991645050718671959023954526967224048964"
      },
      {
        "denominator": "67894273476154765333074068050864959836162590017707142802157783306314110606494705451073302854210174033826814871654176417813095039608310341355076168775682796869312157509758410516767181868825394850076800531680572566651541334436360411183587626055061378844734335964197",
        "numerator": "-15990090941636261330686748858886892057804403777732975571757796649627101699644457963534491214183860757112626273749290381934242782351976199944479473414746028825286221654397604403733246513185788324923363096358639165502950326706866457134045964479481260148764081757655"
      },
      {
        "denominator": "10284856774980965536912364212780667816532529421046654868701198928021267336636547666627634107162325535569373814873960956105840289699594985863929970700734368236260371601067432960321458274209945734836059795239745332524957302784000",